{
  "schemaVersion": "2.0",
  "requireConfigPath": true,
  "reportDir": "sentinel-reports",
  "approvedOrigins": [
    "http://127.0.0.1:3000"
  ],
  "roles": {
    "admin": {
      "tokenRef": "env:SENTINEL_ADMIN_TOKEN"
    },
    "user": {
      "tokenRef": "env:SENTINEL_USER_TOKEN"
    }
  },
  "allowMutations": false,
  "mutationAllowlist": [],
  "allowNonLoopback": false,
  "targetEnvironment": "development",
  "requireCompleteCoverage": true,
  "responseTimeoutMs": 5000,
  "browserSettleMs": 500,
  "viewports": [
    375,
    768,
    1280
  ],
  "screenshotOnError": true,
  "discovery": {
    "openapi": [
      "openapi.json"
    ],
    "vueRouter": [
      "src/router/index.js"
    ]
  }
}
